{
  "accountId": "accountId",
  "customIdentifierFields": {},
  "vendorId": "vendorId",
  "callbackData": {},
  "subAccountId": "subAccountId",
  "items": [
    {
      "itemId": "itemId",
      "quantity": 0.0,
      "skuType": "skuType",
      "customFields": {},
      "catalogData": null
    }
  ]
}